{
  "$schema": "https://json-schema.org/draft/2020-12/schema",
  "$id": "https://local-bench.ai/schemas/accepted_result_projection_v2.schema.json",
  "$defs": {
    "digest": {"type": "string", "pattern": "^[0-9a-f]{64}$"},
    "nullableDigest": {"oneOf": [{"$ref": "#/$defs/digest"}, {"type": "null"}]},
    "score": {"type": "number", "minimum": 0, "maximum": 1},
    "nullableScore": {"oneOf": [{"$ref": "#/$defs/score"}, {"type": "null"}]},
    "safeText": {"type": "string", "pattern": "^[^\\u0000-\\u001f\\u007f-\\u009f\\u202a-\\u202e\\u2066-\\u2069]*$"},
    "safeMultilineText": {"type": "string", "pattern": "^[^\\u0000-\\u0008\\u000b\\u000c\\u000e-\\u001f\\u007f-\\u009f\\u202a-\\u202e\\u2066-\\u2069]*$"},
    "jsonValue": {
      "oneOf": [
        {"type": "null"}, {"type": "boolean"}, {"type": "number"}, {"$ref": "#/$defs/safeMultilineText"},
        {"type": "array", "items": {"$ref": "#/$defs/jsonValue"}},
        {"type": "object", "propertyNames": {"$ref": "#/$defs/safeText"}, "additionalProperties": {"$ref": "#/$defs/jsonValue"}}
      ]
    },
    "jsonObject": {"type": "object", "propertyNames": {"$ref": "#/$defs/safeText"}, "additionalProperties": {"$ref": "#/$defs/jsonValue"}},
    "executionProfile": {
      "oneOf": [
        {"$ref": "#/$defs/executionProfileV1"},
        {"$ref": "#/$defs/executionProfileV2"}
      ]
    },
    "executionProfileV1": {
      "type": "object",
      "additionalProperties": false,
      "required": ["id", "selection_policy_id", "selection_reason", "template_source", "template_sha256", "chat_template_kwargs", "answer_stops", "runtime_probe_passed", "prompt_renderer_engine"],
      "not": {"properties": {"id": {"const": "generic_think_tags_32768_v1"}}, "required": ["id"]},
      "properties": {
        "id": {"$ref": "#/$defs/safeText", "minLength": 1, "maxLength": 120},
        "selection_policy_id": {"$ref": "#/$defs/safeText", "minLength": 1, "maxLength": 120},
        "selection_reason": {"$ref": "#/$defs/safeText", "minLength": 1, "maxLength": 120},
        "template_source": {"$ref": "#/$defs/safeText", "minLength": 1, "maxLength": 120},
        "template_sha256": {"$ref": "#/$defs/nullableDigest"},
        "chat_template_kwargs": {"type": "object", "propertyNames": {"$ref": "#/$defs/safeText"}, "additionalProperties": {"type": "boolean"}},
        "answer_stops": {"type": "array", "uniqueItems": true, "items": {"$ref": "#/$defs/safeText", "minLength": 1, "maxLength": 160}},
        "runtime_probe_passed": {"type": "boolean"},
        "prompt_renderer_engine": {"$ref": "#/$defs/safeText", "minLength": 1, "maxLength": 120},
        "static_think_tokens": {"type": "integer", "minimum": 1},
        "static_final_tokens": {"type": "integer", "minimum": 1},
        "static_max_generated_tokens": {"type": "integer", "minimum": 1},
        "server_context_tokens": {"type": "integer", "minimum": 1},
        "agentic_max_turns": {"type": "integer", "minimum": 1},
        "agentic_max_output_tokens_per_turn": {"type": "integer", "minimum": 1},
        "agentic_max_generated_tokens_per_task": {"type": "integer", "minimum": 1},
        "agentic_context_tokens": {"type": "integer", "minimum": 1},
        "kv_cache_k_dtype": {"const": "f16"},
        "kv_cache_v_dtype": {"const": "f16"},
        "context_fit_policy": {"const": "exact-or-fail"},
        "context_extension_policy": {"const": "none"},
        "per_task_timeout_s": {"type": "integer", "minimum": 1},
        "semantic_sha256": {"$ref": "#/$defs/digest"}
      }
    },
    "executionProfileV2": {
      "type": "object",
      "additionalProperties": false,
      "required": ["id", "selection_policy_id", "selection_reason", "template_source", "template_sha256", "chat_template_kwargs", "answer_stops", "runtime_probe_passed", "prompt_renderer_engine", "schema_version", "static_think_tokens", "static_final_tokens", "static_max_generated_tokens", "server_context_tokens", "agentic_max_turns", "agentic_max_output_tokens_per_turn", "agentic_max_generated_tokens_per_task", "agentic_context_tokens", "kv_cache_k_dtype", "kv_cache_v_dtype", "context_fit_policy", "context_extension_policy", "per_task_timeout_s", "semantic_sha256"],
      "properties": {
        "id": {"const": "generic_think_tags_32768_v1"},
        "selection_policy_id": {"$ref": "#/$defs/safeText", "minLength": 1, "maxLength": 120},
        "selection_reason": {"$ref": "#/$defs/safeText", "minLength": 1, "maxLength": 120},
        "template_source": {"$ref": "#/$defs/safeText", "minLength": 1, "maxLength": 120},
        "template_sha256": {"$ref": "#/$defs/nullableDigest"},
        "chat_template_kwargs": {"type": "object", "propertyNames": {"$ref": "#/$defs/safeText"}, "additionalProperties": {"type": "boolean"}},
        "answer_stops": {"type": "array", "uniqueItems": true, "items": {"$ref": "#/$defs/safeText", "minLength": 1, "maxLength": 160}},
        "runtime_probe_passed": {"type": "boolean"},
        "prompt_renderer_engine": {"$ref": "#/$defs/safeText", "minLength": 1, "maxLength": 120},
        "schema_version": {"const": "localbench.execution_profile.v2"},
        "static_think_tokens": {"const": 32768},
        "static_final_tokens": {"const": 16384},
        "static_max_generated_tokens": {"const": 49152},
        "server_context_tokens": {"const": 65536},
        "agentic_max_turns": {"const": 40},
        "agentic_max_output_tokens_per_turn": {"const": 1024},
        "agentic_max_generated_tokens_per_task": {"const": 65536},
        "agentic_context_tokens": {"const": 32768},
        "kv_cache_k_dtype": {"const": "f16"},
        "kv_cache_v_dtype": {"const": "f16"},
        "context_fit_policy": {"const": "exact-or-fail"},
        "context_extension_policy": {"const": "none"},
        "per_task_timeout_s": {"const": 3000},
        "semantic_sha256": {"const": "e02ef5b5e75f19ca39d8949711bdd2d6517d1ce9267012ac923abffb94fbf058"}
      }
    },
    "axis": {
      "type": "object", "additionalProperties": false,
      "required": ["ci", "n", "score", "status"],
      "properties": {
        "ci": {"oneOf": [{"type": "null"}, {"type": "array", "prefixItems": [{"$ref": "#/$defs/score"}, {"$ref": "#/$defs/score"}], "items": false}]},
        "n": {"type": "integer", "minimum": 0, "maximum": 10000000},
        "score": {"$ref": "#/$defs/nullableScore"},
        "status": {"enum": ["measured", "not_measured", "invalid"]}
      }
    }
  },
  "type": "object",
  "additionalProperties": false,
  "required": ["schema_version", "model", "lineage", "suite_release_id", "suite_manifest_sha256", "scorecard_id", "coverage_profile_id", "headline_complete", "scores", "axes", "conformance", "receipt_references", "artifact_hashes", "origin", "trust_label", "verification_level", "agentic_provenance", "rescore_modes", "validator"],
  "properties": {
    "schema_version": {"const": "localbench.accepted_result_projection.v2"},
    "model": {
      "type": "object", "additionalProperties": false,
      "required": ["display_name", "declared_name", "file_sha256", "identity_status", "model_system_key"],
      "properties": {
        "display_name": {"oneOf": [{"$ref": "#/$defs/safeText", "maxLength": 120}, {"type": "null"}]}, "declared_name": {"oneOf": [{"$ref": "#/$defs/safeText", "maxLength": 120}, {"type": "null"}]},
        "file_sha256": {"$ref": "#/$defs/nullableDigest"}, "file_size_bytes": {"type": ["integer", "null"], "minimum": 1},
        "file_name": {"oneOf": [{"$ref": "#/$defs/safeText", "maxLength": 140}, {"type": "null"}]}, "family": {"oneOf": [{"$ref": "#/$defs/safeText", "maxLength": 64}, {"type": "null"}]},
        "quant_label": {"oneOf": [{"$ref": "#/$defs/safeText", "maxLength": 32}, {"type": "null"}]}, "format": {"oneOf": [{"$ref": "#/$defs/safeText", "maxLength": 64}, {"type": "null"}]},
        "tokenizer_digest": {"$ref": "#/$defs/nullableDigest"}, "chat_template_digest": {"$ref": "#/$defs/nullableDigest"},
        "identity_status": {"enum": ["unverified", "maintainer_verified"]},
        "model_system_key": {"type": "string", "pattern": "^(artifact|legacy-project-anchor):[0-9a-f]{64}$"}
      }
    },
    "lineage": {"type": "object", "additionalProperties": false, "required": ["base_model"], "properties": {"base_model": {"type": "array", "maxItems": 8, "uniqueItems": true, "items": {"$ref": "#/$defs/safeText", "minLength": 1, "maxLength": 140}}}},
    "execution_profile": {"$ref": "#/$defs/executionProfile"},
    "runtime": {"oneOf": [
      {
        "type": "object", "additionalProperties": false, "required": ["name", "version", "backend"],
        "properties": {
          "name": {"oneOf": [{"$ref": "#/$defs/safeText", "maxLength": 120}, {"type": "null"}]},
          "version": {"oneOf": [{"$ref": "#/$defs/safeText", "maxLength": 120}, {"type": "null"}]},
          "backend": {"oneOf": [{"$ref": "#/$defs/safeText", "maxLength": 120}, {"type": "null"}]}
        }
      },
      {
        "type": "object", "additionalProperties": false, "required": ["name", "version"],
        "properties": {
          "name": {"$ref": "#/$defs/safeText", "minLength": 1, "maxLength": 120}, "version": {"$ref": "#/$defs/safeText", "minLength": 1, "maxLength": 120},
          "kv_cache_quant": {"oneOf": [{"$ref": "#/$defs/safeText", "minLength": 1, "maxLength": 64}, {"type": "null"}]}, "ctx_len_configured": {"type": ["integer", "null"], "minimum": 1},
          "parallel_slots": {"type": ["integer", "null"], "minimum": 1}, "build_flags": {"oneOf": [{"$ref": "#/$defs/safeMultilineText", "maxLength": 500}, {"type": "null"}]}
        }
      }
    ]},
    "hardware": {
      "type": "object", "additionalProperties": false, "required": ["gpu_name", "vram_gb"],
      "properties": {
        "gpu_name": {"oneOf": [{"$ref": "#/$defs/safeText", "maxLength": 160}, {"type": "null"}]},
        "vram_gb": {"type": ["number", "null"], "minimum": 0}
      }
    },
    "perf": {
      "type": "object", "additionalProperties": false, "required": ["decode_tps", "wall_time_seconds", "tokens_to_answer_median"],
      "properties": {
        "decode_tps": {"type": ["number", "null"], "minimum": 0},
        "overall_tps": {"type": "number", "minimum": 0},
        "prefill_tps": {"type": "number", "minimum": 0},
        "wall_time_seconds": {"type": ["number", "null"], "minimum": 0},
        "tokens_to_answer_median": {"type": ["number", "null"], "minimum": 0}
      }
    },
    "suite_release_id": {"enum": ["suite-v1-partial-text-code-4axis-v1", "suite-v1-text-code-agentic-5axis-v1", "suite-v1-full-exec-6axis-v1", "suite-v1-static-exec-5axis-v1", "suite-v1-static-core-diag-v1", "suite-v2-full-exec-tooluse-5axis-v2"]}, "suite_manifest_sha256": {"$ref": "#/$defs/digest"},
    "scorecard_id": {"$ref": "#/$defs/safeText", "minLength": 1, "maxLength": 120}, "coverage_profile_id": {"$ref": "#/$defs/safeText", "minLength": 1, "maxLength": 120},
    "index_version": {"enum": ["index-v3.0", "index-v4.0", "index-v4.1", "index-v4.2"]},
    "headline_complete": {"type": "boolean"},
    "scores": {
      "type": "object", "additionalProperties": false,
      "required": ["headline_score", "partial_composite", "partial_composite_scope", "measured_headline_weight", "missing_headline_weight", "known_headline_contribution", "rank_scope"],
      "properties": {
        "headline_score": {"$ref": "#/$defs/nullableScore"}, "partial_composite": {"$ref": "#/$defs/score"},
        "partial_composite_scope": {"const": "measured_headline_axes"}, "measured_headline_weight": {"$ref": "#/$defs/score"},
        "missing_headline_weight": {"$ref": "#/$defs/score"}, "known_headline_contribution": {"$ref": "#/$defs/score"},
        "rank_scope": {"$ref": "#/$defs/safeMultilineText", "minLength": 1}, "composite_static": {"$ref": "#/$defs/nullableScore"},
        "composite_full": {"$ref": "#/$defs/nullableScore"}, "static_index_version": {"$ref": "#/$defs/safeText", "minLength": 1, "maxLength": 120}
      }
    },
    "axes": {"type": "object", "minProperties": 1, "maxProperties": 16, "propertyNames": {"$ref": "#/$defs/safeText", "minLength": 1, "maxLength": 40}, "additionalProperties": {"$ref": "#/$defs/axis"}},
    "conformance": {
      "type": "object", "additionalProperties": false,
      "properties": {
        "status": {"$ref": "#/$defs/safeText", "minLength": 1, "maxLength": 80},
        "n_scored": {"type": "integer", "minimum": 0},
        "worst_bench": {"oneOf": [{"$ref": "#/$defs/safeText", "minLength": 1, "maxLength": 120}, {"type": "null"}]},
        "reasons": {"type": "array", "items": {"$ref": "#/$defs/safeText", "maxLength": 300}},
        "per_bench": {"$ref": "#/$defs/jsonObject"}
      }
    },
    "receipt_references": {"type": "object", "additionalProperties": false, "required": ["coding_receipt_sha256"], "properties": {"coding_receipt_sha256": {"$ref": "#/$defs/nullableDigest"}}},
    "artifact_hashes": {"type": "object", "additionalProperties": false, "required": ["bundle_sha256", "projection_sha256", "public_artifact_manifest_sha256"], "properties": {"bundle_sha256": {"$ref": "#/$defs/digest"}, "projection_sha256": {"$ref": "#/$defs/digest"}, "public_artifact_manifest_sha256": {"$ref": "#/$defs/digest"}}},
    "origin": {"enum": ["project_anchor", "community"]},
    "trust_label": {"enum": ["project_anchor", "community_self_submitted", "community_re_scored"]},
    "verification_level": {"enum": ["bundle_rescored", "client_reported"]}, "agentic_provenance": {"enum": ["none", "project_attested", "self_reported"]},
    "provenance_notes": {"type": "array", "items": {"$ref": "#/$defs/safeText", "maxLength": 300}},
    "rescore_modes": {
      "type": "object", "additionalProperties": false,
      "properties": {
        "amo": {"enum": ["rescored", "verdict_carried"]}, "appworld_c": {"enum": ["rescored", "verdict_carried"]},
        "bfcl": {"enum": ["rescored", "verdict_carried"]}, "bfcl_multi_turn_base": {"enum": ["rescored", "verdict_carried"]},
        "bfcl_multi_turn_long_context": {"enum": ["rescored", "verdict_carried"]}, "bigcodebench_hard": {"enum": ["rescored", "verdict_carried"]},
        "ifbench": {"enum": ["rescored", "verdict_carried"]}, "lcb": {"enum": ["rescored", "verdict_carried"]},
        "mmlu_pro": {"enum": ["rescored", "verdict_carried"]},
        "olymmath_hard": {"enum": ["rescored", "verdict_carried"]}, "tc_json_v1": {"enum": ["rescored", "verdict_carried"]}
      }
    },
    "validator": {"type": "object", "additionalProperties": false, "required": ["validator_version", "commit", "validated_at"], "properties": {"validator_version": {"$ref": "#/$defs/safeText", "minLength": 1, "maxLength": 120}, "commit": {"oneOf": [{"$ref": "#/$defs/safeText", "minLength": 1, "maxLength": 120}, {"type": "null"}]}, "validated_at": {"type": "string", "format": "date-time"}}}
  },
  "allOf": [
    {"if": {"properties": {"origin": {"const": "community"}}}, "then": {"properties": {"model": {"properties": {"identity_status": {"const": "unverified"}, "file_sha256": {"$ref": "#/$defs/digest"}, "model_system_key": {"pattern": "^artifact:[0-9a-f]{64}$"}}}}}},
    {"if": {"properties": {"suite_release_id": {"const": "suite-v1-full-exec-6axis-v1"}}}, "then": {"properties": {"suite_manifest_sha256": {"const": "c4098df81440c4489ee8c6d6967f3a5d6f9d6941810779abd135326ad734f468"}}}},
    {"if": {"properties": {"suite_release_id": {"const": "suite-v1-static-exec-5axis-v1"}}}, "then": {"properties": {"suite_manifest_sha256": {"const": "4e240f8cffe8826ef1fd723f54b4b789d93990851d838818bce0954a38c61d64"}}}},
    {"if": {"properties": {"suite_release_id": {"const": "suite-v1-partial-text-code-4axis-v1"}}}, "then": {"properties": {"suite_manifest_sha256": {"const": "95f86098b23d4055b563f1ba015c005350a6f7a1d721489b26c6c1d86e8054e7"}}}},
    {"if": {"properties": {"suite_release_id": {"const": "suite-v1-text-code-agentic-5axis-v1"}}}, "then": {"properties": {"suite_manifest_sha256": {"const": "1b6a716050edd24fee4f0f0bea748407ee3fcd4d61622d69232943cc315f0a2f"}}}},
    {"if": {"properties": {"suite_release_id": {"const": "suite-v1-static-core-diag-v1"}}}, "then": {"properties": {"suite_manifest_sha256": {"const": "f2f8c9a67df3adea5cec463fc156ccae073ea9deb54d4487d72b9826fe385c69"}}}}
  ]
}
