{"agentic_provenance":"self_reported","artifact_hashes":{"bundle_sha256":"704246598a1b25ea8899f8cd43881b2e0bf148a7a585ac413670f1ba64666da3","projection_sha256":"fc3aaa2d792408d7ddd1aeb6b59ad669747e437f26a7fe35f0cd8cdd316cb53d","public_artifact_manifest_sha256":"fde852b5eae5a514d39b78f2bffe86e0d53dec6c1ee761e27fef8afc962454a4"},"axes":{"bfcl_multi_turn_long_context":{"ci":null,"n":0,"score":null,"status":"not_measured"},"bfcl_single_turn":{"ci":null,"n":0,"score":null,"status":"not_measured"},"call_formatting":{"ci":null,"n":0,"score":null,"status":"not_measured"},"coding":{"ci":null,"n":141,"score":1.0,"status":"measured"},"instruction_following":{"ci":null,"n":0,"score":null,"status":"not_measured"},"knowledge":{"ci":null,"n":0,"score":null,"status":"not_measured"},"long_context":{"ci":null,"n":0,"score":null,"status":"not_measured"},"math":{"ci":null,"n":0,"score":null,"status":"not_measured"},"tool_use":{"ci":null,"n":0,"score":null,"status":"measured"}},"conformance":{},"coverage_profile_id":"text-code-agentic-5axis-v1","headline_complete":false,"index_version":"index-v3.0","lineage":{"base_model":[]},"model":{"chat_template_digest":"cccccccccccccccccccccccccccccccccccccccccccccccccccccccccccccccc","declared_name":"gemma","display_name":null,"family":"gemma","file_name":"model.gguf","file_sha256":"aaaaaaaaaaaaaaaaaaaaaaaaaaaaaaaaaaaaaaaaaaaaaaaaaaaaaaaaaaaaaaaa","file_size_bytes":11,"format":"gguf","identity_status":"maintainer_verified","model_system_key":"artifact:aaaaaaaaaaaaaaaaaaaaaaaaaaaaaaaaaaaaaaaaaaaaaaaaaaaaaaaaaaaaaaaa","quant_label":"Q4_K_M","tokenizer_digest":"bbbbbbbbbbbbbbbbbbbbbbbbbbbbbbbbbbbbbbbbbbbbbbbbbbbbbbbbbbbbbbbb"},"origin":"project_anchor","provenance_notes":["attestation_missing:appworld_c/synthetic-agentic-1"],"receipt_references":{"coding_receipt_sha256":"153ba8394601e59faec6e51714c23e7b2515ac5ab9719fc564177f648d784bf4"},"rescore_modes":{"appworld_c":"verdict_carried","bigcodebench_hard":"verdict_carried"},"runtime":{"build_flags":"cuda","ctx_len_configured":8192,"kv_cache_quant":"q8_0","name":"llama.cpp","parallel_slots":1,"version":"b1234"},"schema_version":"localbench.accepted_result_projection.v2","scorecard_id":"None","scores":{"composite_full":null,"composite_static":null,"headline_score":null,"known_headline_contribution":0.475,"measured_headline_weight":0.48,"missing_headline_weight":0.53,"partial_composite":1.0,"partial_composite_scope":"measured_headline_axes","rank_scope":"custom-partial-v1"},"suite_manifest_sha256":"c4098df81440c4489ee8c6d6967f3a5d6f9d6941810779abd135326ad734f468","suite_release_id":"suite-v1-full-exec-6axis-v1","trust_label":"project_anchor","validator":{"commit":null,"validated_at":"2026-07-14T00:00:00Z","validator_version":"localbench.submission-validator.v1"},"verification_level":"bundle_rescored"}
